{
  "schema_version": "2.0",
  "curated_at": "2026-09-13",
  "catalog_sha256": "97af35dedc3fdf715316a4dcdae13142f3508a148a6981e9ded50bc72f3d1fb3",
  "count": 58,
  "resources": [
    {
      "name": "OpenAI Evals",
      "url": "https://github.com/openai/evals",
      "canonical_url": "https://github.com/openai/evals",
      "description": "Framework for evaluating LLMs and LLM systems; useful for custom evals and benchmark registries.",
      "section": "Evaluation and testing",
      "type": "evaluation-framework",
      "status": "active",
      "archived": false,
      "license": null,
      "last_verified": null,
      "authoritative_source": "https://github.com/openai/evals"
    },
    {
      "name": "promptfoo",
      "url": "https://github.com/promptfoo/promptfoo",
      "canonical_url": "https://github.com/promptfoo/promptfoo",
      "description": "Test prompts, agents and RAGs; supports red teaming, model comparison and CI/CD.",
      "section": "Evaluation and testing",
      "type": "evaluation-framework",
      "status": "active",
      "archived": false,
      "license": null,
      "last_verified": null,
      "authoritative_source": "https://github.com/promptfoo/promptfoo"
    },
    {
      "name": "DeepEval",
      "url": "https://github.com/confident-ai/deepeval",
      "canonical_url": "https://github.com/confident-ai/deepeval",
      "description": "Pytest-like LLM evaluation framework with RAG, agentic, hallucination, toxicity and custom metrics.",
      "section": "Evaluation and testing",
      "type": "evaluation-framework",
      "status": "active",
      "archived": false,
      "license": null,
      "last_verified": null,
      "authoritative_source": "https://github.com/confident-ai/deepeval"
    },
    {
      "name": "RAGAS",
      "url": "https://github.com/vibrantlabsai/ragas",
      "canonical_url": "https://github.com/vibrantlabsai/ragas",
      "description": "Evaluation framework for retrieval-augmented generation applications.",
      "section": "Evaluation and testing",
      "type": "evaluation-framework",
      "status": "active",
      "archived": false,
      "license": null,
      "last_verified": null,
      "authoritative_source": "https://github.com/vibrantlabsai/ragas"
    },
    {
      "name": "Giskard",
      "url": "https://github.com/Giskard-AI/giskard-oss",
      "canonical_url": "https://github.com/Giskard-AI/giskard-oss",
      "description": "Testing framework for ML and LLM systems with vulnerability detection.",
      "section": "Evaluation and testing",
      "type": "evaluation-framework",
      "status": "active",
      "archived": false,
      "license": null,
      "last_verified": null,
      "authoritative_source": "https://github.com/Giskard-AI/giskard-oss"
    },
    {
      "name": "Evidently",
      "url": "https://github.com/evidentlyai/evidently",
      "canonical_url": "https://github.com/evidentlyai/evidently",
      "description": "ML and LLM evaluation, monitoring and drift reports.",
      "section": "Evaluation and testing",
      "type": "evaluation-framework",
      "status": "active",
      "archived": false,
      "license": null,
      "last_verified": null,
      "authoritative_source": "https://github.com/evidentlyai/evidently"
    },
    {
      "name": "TruLens",
      "url": "https://github.com/truera/trulens",
      "canonical_url": "https://github.com/truera/trulens",
      "description": "Evaluation and tracking for LLM applications.",
      "section": "Evaluation and testing",
      "type": "evaluation-framework",
      "status": "active",
      "archived": false,
      "license": null,
      "last_verified": null,
      "authoritative_source": "https://github.com/truera/trulens"
    },
    {
      "name": "EleutherAI lm-evaluation-harness",
      "url": "https://github.com/EleutherAI/lm-evaluation-harness",
      "canonical_url": "https://github.com/EleutherAI/lm-evaluation-harness",
      "description": "Language model evaluation harness used across many benchmarks.",
      "section": "Evaluation and testing",
      "type": "evaluation-framework",
      "status": "active",
      "archived": false,
      "license": null,
      "last_verified": null,
      "authoritative_source": "https://github.com/EleutherAI/lm-evaluation-harness"
    },
    {
      "name": "Arize Phoenix",
      "url": "https://github.com/Arize-ai/phoenix",
      "canonical_url": "https://github.com/Arize-ai/phoenix",
      "description": "Open-source AI observability and evaluation platform for tracing, datasets, experiments and prompt management.",
      "section": "Observability and monitoring",
      "type": "observability-tool",
      "status": "active",
      "archived": false,
      "license": null,
      "last_verified": null,
      "authoritative_source": "https://github.com/Arize-ai/phoenix"
    },
    {
      "name": "Opik",
      "url": "https://github.com/comet-ml/opik",
      "canonical_url": "https://github.com/comet-ml/opik",
      "description": "Open-source platform for debugging, evaluating and monitoring LLM applications, RAG systems and agentic workflows.",
      "section": "Observability and monitoring",
      "type": "observability-tool",
      "status": "active",
      "archived": false,
      "license": null,
      "last_verified": null,
      "authoritative_source": "https://github.com/comet-ml/opik"
    },
    {
      "name": "Langfuse",
      "url": "https://github.com/langfuse/langfuse",
      "canonical_url": "https://github.com/langfuse/langfuse",
      "description": "Open-source LLM engineering platform for traces, evaluations, prompt management and metrics.",
      "section": "Observability and monitoring",
      "type": "observability-tool",
      "status": "active",
      "archived": false,
      "license": null,
      "last_verified": null,
      "authoritative_source": "https://github.com/langfuse/langfuse"
    },
    {
      "name": "Helicone",
      "url": "https://github.com/Helicone/helicone",
      "canonical_url": "https://github.com/Helicone/helicone",
      "description": "Open-source LLM observability platform and gateway.",
      "section": "Observability and monitoring",
      "type": "observability-tool",
      "status": "active",
      "archived": false,
      "license": null,
      "last_verified": null,
      "authoritative_source": "https://github.com/Helicone/helicone"
    },
    {
      "name": "OpenTelemetry",
      "url": "https://github.com/open-telemetry/opentelemetry-collector",
      "canonical_url": "https://github.com/open-telemetry/opentelemetry-collector",
      "description": "Observability collector; useful foundation for production telemetry.",
      "section": "Observability and monitoring",
      "type": "observability-tool",
      "status": "active",
      "archived": false,
      "license": null,
      "last_verified": null,
      "authoritative_source": "https://github.com/open-telemetry/opentelemetry-collector"
    },
    {
      "name": "WhyLabs",
      "url": "https://github.com/whylabs/whylogs",
      "canonical_url": "https://github.com/whylabs/whylogs",
      "description": "data and ML logging/profiling for monitoring pipelines, with current suitability to be checked before adoption.",
      "section": "Observability and monitoring",
      "type": "observability-tool",
      "status": "maintenance-review",
      "archived": false,
      "license": null,
      "last_verified": null,
      "authoritative_source": "https://github.com/whylabs/whylogs"
    },
    {
      "name": "NVIDIA NeMo Guardrails",
      "url": "https://github.com/NVIDIA-NeMo/Guardrails",
      "canonical_url": "https://github.com/NVIDIA-NeMo/Guardrails",
      "description": "Programmable guardrails for LLM conversational systems.",
      "section": "Guardrails and safety",
      "type": "guardrail-tool",
      "status": "active",
      "archived": false,
      "license": null,
      "last_verified": null,
      "authoritative_source": "https://github.com/NVIDIA-NeMo/Guardrails"
    },
    {
      "name": "Guardrails AI",
      "url": "https://github.com/guardrails-ai/guardrails",
      "canonical_url": "https://github.com/guardrails-ai/guardrails",
      "description": "Input/output guards, validators and structured output validation for LLM applications.",
      "section": "Guardrails and safety",
      "type": "guardrail-tool",
      "status": "active",
      "archived": false,
      "license": null,
      "last_verified": null,
      "authoritative_source": "https://github.com/guardrails-ai/guardrails"
    },
    {
      "name": "LLM Guard",
      "url": "https://github.com/protectai/llm-guard",
      "canonical_url": "https://github.com/protectai/llm-guard",
      "description": "retained as a historical prompt/output sanitization reference, not a recommendation for new integrations.",
      "section": "Guardrails and safety",
      "type": "guardrail-tool",
      "status": "archived",
      "archived": true,
      "license": null,
      "last_verified": null,
      "authoritative_source": "https://github.com/protectai/llm-guard"
    },
    {
      "name": "Rebuff",
      "url": "https://github.com/protectai/rebuff",
      "canonical_url": "https://github.com/protectai/rebuff",
      "description": "retained as a historical prompt-injection defense reference, not a recommendation for new integrations.",
      "section": "Guardrails and safety",
      "type": "guardrail-tool",
      "status": "archived",
      "archived": true,
      "license": null,
      "last_verified": null,
      "authoritative_source": "https://github.com/protectai/rebuff"
    },
    {
      "name": "Llama Guard",
      "url": "https://github.com/meta-llama/PurpleLlama",
      "canonical_url": "https://github.com/meta-llama/PurpleLlama",
      "description": "Meta Purple Llama safety tools including Llama Guard resources.",
      "section": "Guardrails and safety",
      "type": "guardrail-tool",